{"schema_version":"agenttrust.gateway-config.v1","fail_closed":false,"profile":"development","data_listener":"127.0.0.1:8080","management_listener":"127.0.0.1:9090","identity_verifier":"dev-signed-explicit","global_concurrency":128,"max_body_bytes":1048576,"max_header_bytes":32768,"max_headers":64,"per_tenant_concurrency":16,"per_agent_concurrency":4,"per_tenant_requests_per_minute":600,"require_idempotency_key":true,"idempotency_ttl_seconds":86400,"max_idempotency_records":10000,"max_idempotency_records_per_tenant":1000,"request_timeout_ms":30000,"downstream_timeout_ms":20000,"circuit_failure_threshold":5,"circuit_open_ms":30000,"max_stream_duration_ms":3600000}
