{"schema_version":"agenttrust.gateway-config.v1","fail_closed":true,"profile":"production","data_listener":"0.0.0.0:8443","management_listener":"127.0.0.1:9090","identity_verifier":"oidc-mtls-required","global_concurrency":2048,"max_body_bytes":1048576,"max_header_bytes":32768,"max_headers":64,"per_tenant_concurrency":64,"per_agent_concurrency":8,"per_tenant_requests_per_minute":1200,"require_idempotency_key":true,"idempotency_ttl_seconds":86400,"max_idempotency_records":100000,"max_idempotency_records_per_tenant":10000,"request_timeout_ms":30000,"downstream_timeout_ms":20000,"circuit_failure_threshold":5,"circuit_open_ms":30000,"max_stream_duration_ms":3600000}
